{
  "$schema": "http://json-schema.org/draft-07/schema#",
  "title": "Building GeoJSON Feature",
  "type": "object",
  "required": [
    "type",
    "id",
    "geometry",
    "properties"
  ],
  "properties": {
    "type": {
      "type": "string",
      "enum": [
        "Feature"
      ]
    },
    "id": {
      "type": "string"
    },
    "geometry": {
      "type": "object",
      "required": [
        "type",
        "coordinates"
      ],
      "properties": {
        "type": {
          "type": "string",
          "enum": [
            "Point"
          ]
        },
        "coordinates": {
          "type": "array",
          "minItems": 2,
          "maxItems": 2,
          "items": {
            "type": "number"
          }
        }
      }
    },
    "properties": {
      "type": "object",
      "required": [
        "name"
      ],
      "properties": {
        "name": {
          "type": "string"
        },
        "description": {
          "type": "string"
        }
      }
    }
  }
}